{
  "schemaVersion": "1.0.0",
  "indexerVersion": "0.1.0-SNAPSHOT",
  "runMetadata": {
    "startedAt": "2026-03-10T12:00:00Z",
    "completedAt": "2026-03-10T12:00:01Z",
    "outcome": "PARTIAL",
    "detectedTechnologies": [
      "java",
      "typescript"
    ],
    "metadata": {
      "fixture": "minimal-success"
    }
  },
  "source": {
    "repositoryId": "fixture-mixed-repo",
    "acquisitionType": "local-path",
    "path": "/fixtures/java-backend",
    "remoteUrl": null,
    "branch": "main",
    "revision": "abc123",
    "acquiredAt": "2026-03-10T12:00:00Z",
    "metadata": {}
  },
  "scopes": [
    {
      "id": "scope:repo",
      "kind": "REPOSITORY",
      "name": "fixture-java-backend",
      "displayName": "fixture-java-backend",
      "parentScopeId": null,
      "sourceRefs": [
        {
          "path": "src/main/java/com/example/DemoController.java",
          "startLine": 1,
          "endLine": 20,
          "snippet": "class DemoController",
          "metadata": {}
        }
      ],
      "metadata": {}
    },
    {
      "id": "scope:package:com.example",
      "kind": "PACKAGE",
      "name": "com.example",
      "displayName": "com.example",
      "parentScopeId": "scope:repo",
      "sourceRefs": [
        {
          "path": "src/main/java/com/example/DemoController.java",
          "startLine": 1,
          "endLine": 20,
          "snippet": "package com.example;",
          "metadata": {}
        }
      ],
      "metadata": {
        "language": "java"
      }
    }
  ],
  "entities": [
    {
      "id": "entity:class:demo-controller",
      "kind": "CLASS",
      "origin": "OBSERVED",
      "name": "DemoController",
      "displayName": "com.example.DemoController",
      "scopeId": "scope:package:com.example",
      "sourceRefs": [
        {
          "path": "src/main/java/com/example/DemoController.java",
          "startLine": 3,
          "endLine": 18,
          "snippet": "public class DemoController",
          "metadata": {}
        }
      ],
      "metadata": {
        "language": "java"
      }
    },
    {
      "id": "entity:endpoint:demo",
      "kind": "ENDPOINT",
      "origin": "INFERRED",
      "name": "Demo endpoint",
      "displayName": "GET /demo",
      "scopeId": "scope:package:com.example",
      "sourceRefs": [
        {
          "path": "src/main/java/com/example/DemoController.java",
          "startLine": 8,
          "endLine": 12,
          "snippet": "@GetMapping(\"/demo\")",
          "metadata": {}
        }
      ],
      "metadata": {
        "httpMethod": "GET",
        "path": "/demo"
      }
    }
  ],
  "relationships": [
    {
      "id": "rel:controller:exposes:endpoint",
      "kind": "EXPOSES",
      "fromEntityId": "entity:class:demo-controller",
      "toEntityId": "entity:endpoint:demo",
      "label": "controller exposes endpoint",
      "sourceRefs": [
        {
          "path": "src/main/java/com/example/DemoController.java",
          "startLine": 8,
          "endLine": 12,
          "snippet": "@GetMapping(\"/demo\")",
          "metadata": {}
        }
      ],
      "metadata": {}
    }
  ],
  "diagnostics": [
    {
      "id": "diag:ts-parse-1",
      "severity": "WARNING",
      "phase": "EXTRACTION",
      "code": "typescript.parse-error",
      "message": "Failed to parse src/web/broken.tsx; continuing with partial result",
      "fatal": false,
      "filePath": "src/web/broken.tsx",
      "scopeId": null,
      "entityId": null,
      "sourceRefs": [
        {
          "path": "src/web/broken.tsx",
          "startLine": 14,
          "endLine": 14,
          "snippet": "const = ;",
          "metadata": {}
        }
      ],
      "metadata": {}
    }
  ],
  "completeness": {
    "status": "PARTIAL",
    "indexedFileCount": 7,
    "totalFileCount": 8,
    "degradedFileCount": 1,
    "omittedPaths": [
      "src/web/broken.tsx"
    ],
    "notes": [
      "One TypeScript file failed structural extraction and was omitted from inferred entities"
    ]
  },
  "metadata": {}
}